{"$id":"rewardbotj.config.schema.json","$schema":"http://json-schema.org/draft-07/schema#","title":"Configuration","type":"object","required":["channel","oauth","commands"],"properties":{"channel":{"type":"string","description":"The streamer's channel"},"bot_name":{"type":"string","description":"The Twitch bot account"},"oauth":{"type":"string","description":"OAuth Token for IRC USer (You can get yours here: http://twitchapps.com/tmi/)"},"commands":{"type":"array","items":{"$ref":"#/definitions/command"}}},"definitions":{"command":{"title":"Command","type":"object","required":["twitchRewardId","action"],"properties":{"optionalName":{"type":"string","description":"The name of this command. Optional - used mostly for debugging."},"twitchRewardId":{"type":"string","description":"Twitch-generated identifier for your custom channel points reward. You can find your reward ID here: https://www.instafluff.tv/TwitchCustomRewardID/?channel=yourchannel"},"action":{"$ref":"#/definitions/action"}}},"action":{"type":"object","title":"Action","properties":{"name":{"type":"string","description":"The name of this action; optional, for debugging."},"messageToWhisper":{"type":"string","description":"A message to whisper to your bot (if configured). Useful for triggering Streamlabs Chatbot commands."},"keysToPress":{"type":"string","description":" string to represent hotkeys. Must follow the Java KeyStroke format:\n      # See: https://docs.oracle.com/javase/7/docs/api/javax/swing/KeyStroke.html#getKeyStroke(java.lang.String)\n      # example: shift control alt command A"}}}}}
