{
  "bot_name": "countabot",
  "channel": "miscounting",
  "oauth": "mySecretToken",
  "commands": [
    {
      "optionalName": "beard",
      "twitchRewardId": "d72c04c1-0c6e-4b83-ad06-e1abf1c2d6ca",
      "action": {
        "name": "beard filter",
        "keysToPress": "shift control alt meta 1"
      }
    },
    {
      "optionalName": "glam",
      "twitchRewardId": "c1b3575f-273e-4427-b999-82a587fa2c62",
      "action": {
        "keysToPress": "shift control alt meta 2"
      }
    },
    {
      "optionalName": "random unflattering filter",
      "twitchRewardId": "a4188288-eb26-42fb-a613-a25df345c950",
      "action": {
        "performAtRandom": [
          {
            "name": "spider",
            "keysToPress": "shift control alt meta A"
          },
          {
            "name": "fart sound",
            "messageToWhisper": "!farts"
          }
        ]
      }
    }
  ]
}